Иванка Трамп станет помощником отца, но не будет получать зарплату https://t.co/1nLiy8XpDv https://t.co/Pcfp70TApI
Официальный Лондон раскроет детали проекта по замене законов Евросоюза https://t.co/RBrUDjKYXN https://t.co/kL8mNiAbmt
В Архангельске Путин встретится с президентами Финляндии и Исландии https://t.co/tLGyH3Xivz https://t.co/V4iOsUo11R
Захарова прокомментировала влияние Порошенко и радикалов на Украине https://t.co/UVaM6H5fMd https://t.co/XyC7GWPsuW
Российская экономика выбралась из двухлетней рецессии и взяла курс на восстановление https://t.co/2Iz0CZl2Mg https://t.co/nWrQULsWlM
Одесситов удивили "патриотические уголки" в женских консультациях https://t.co/y9F4JkfYS2 https://t.co/a5GyleHQiU
Челси Клинтон заявила, что не намерена участвовать в выборах https://t.co/B4paZxGYhw https://t.co/VoBpkmg34b
Идея для фильма ужасов: в соцсетях посмеялись над бюстом Роналду https://t.co/15pmstPAq5 https://t.co/YdrdQjlaQ8
Турция объявила об успешном завершении операции "Щит Евфрата" в Сирии https://t.co/6KUSvn8F7a https://t.co/KbpAXBZbK6
Глава ГАИ Москвы предложил стритрейсерам провести соревнования на трассе https://t.co/77g7aaV45Y https://t.co/kLG7cdRV27
СКА стал первым финалистом Кубка Гагарина https://t.co/uj3xDYI5zA https://t.co/eMvFaDwjIX
Силуанов прокомментировал решение Высокого суда Лондона по украинскому долгу https://t.co/DioK9Sb3nt https://t.co/wt6DeJ4oMO
Путин: Россия готова к совместному освоению Арктики с иностранными партнерами https://t.co/YTySmg35wA https://t.co/BlMG94Gh9a
Рейтинг одобрения Трампа упал до рекордно низкого уровня https://t.co/THGOJDWypo https://t.co/pKKu488h4E
Власти США задержали прокурора мексиканского штата https://t.co/HgeAtsO3w7 https://t.co/R5ifKBYIez
Приведет ли кризис американской исключительности к "диалогу" Европы с российскими "Искандерами"?… https://t.co/O5GEpozY02
Минфин Украины подтвердил решение суда Лондона по долгу перед Россией https://t.co/e6t9P4Dz0x https://t.co/P1AcNYDnis
Samsung представила новые смартфоны Galaxy S8 и S8+ https://t.co/SWThj18Cjo https://t.co/4K79fpBy3O
Крупный пожар произошел в аэропорту Орли https://t.co/t4Eblb2Lb8 https://t.co/xJ6Cqa8zB5
В Германии объявлен поиск "русскоговорящих статистов" для "реалистичности" учений армии США https://t.co/GeQUot4dz9 https://t.co/2tb3NdRNSG
На Аляске заявили, что штат был бы более развитым под управлением Москвы https://t.co/IOIJVcuTWR https://t.co/1vPvwkBMUA
#РИА_Видео Владимир Путин и Дмитрий Медведев посетили остров Земля Александры архипелага Земля Франца-Иосифа… https://t.co/0PwT5fH93G
Деньги вперед: Politico рассказала, чего Тиллерсон хочет добиться от НАТО https://t.co/FwQlDE2bXD https://t.co/3k7FqTQTdV
В России завели уголовное дело после убийства Вороненкова, сообщил источник https://t.co/Ynvmqy1pDx https://t.co/4e8KsPaKxC
В Лондоне прошли похороны Джорджа Майкла https://t.co/lfggVJN40p https://t.co/dlBVZN516x
Путин высек из ледника осколки для научных исследований https://t.co/Hx9DBGEbBt https://t.co/mB7hX1LpWO
Юрий Лоза прокомментировал ситуацию с "Евровидением" https://t.co/LpYS1pQk30 https://t.co/aOWYU7bPoL
#РИА_ФотоДня Подробнее: https://t.co/EirxQJJ5bk https://t.co/TtNwwIxnei
Отпентагонят и бросят, – Захарова прокомментировала заявление США по ситуации в Мосуле https://t.co/zzaRXCvrux https://t.co/7JfuFhqWex
Процесс по долгу Украины перед Россией продолжится в апелляционном суде https://t.co/FFSIYcV5al https://t.co/fm55I5DDo7
ФСБ рассказала о причине обысков в подмосковном центре саентологов https://t.co/W2e8h3HM9I https://t.co/3ubIYxda5m
В Пентагоне призвали готовиться к "звездным войнам" https://t.co/m3bqrIE9lr https://t.co/1IimsK1MmD
Лавров: Киев хочет похоронить минские соглашения, возложив вину на Россию https://t.co/lsTtX1lK2N https://t.co/UZzOgNVqTL
Умер известный журналист-международник Юрий Выборнов https://t.co/vuUDnUZ4ta https://t.co/DU96eRwf8A
Суд приостановил деятельность сервиса https://t.co/PQyxLxWIzy в Турции https://t.co/3tNwYP0mcV https://t.co/xjOkjl3Y0M
Шпионский скандал стал новым витком в эскалации напряжения, возникшего в последнее время между Берлином и Анкарой… https://t.co/QQfXckdUeN
В соцсетях высмеяли презентацию Киева к "Евровидению-2017" https://t.co/K1h9RUC2x0 https://t.co/ynFLGrvn4U
Пранкер Вован назвал обвинения в розыгрыше Дуды от имени Порошенко бредом https://t.co/VtkdmvGAFq https://t.co/qVtsUwQkTk
Поспешите подписаться на наш Telegram-канал, чтобы всегда быть в курсе главных тем дня https://t.co/QuxzNXKEkj https://t.co/32eRJKcIfz
Путин пожелал журналистам не замерзнуть в Арктике https://t.co/GVofE6Dclb https://t.co/TTX88NsVHS
Лавров: Путин и Трамп встретятся, когда это будет удобно обеим сторонам https://t.co/wvdE2QAAw4 https://t.co/GbQMSBTQEK
?? «Важное за день» https://t.co/wqZ14i2iMj
Высокий суд Лондона обязал Украину выплатить России долг на $3 млрд, сообщил Минфин https://t.co/Hg1FzupTlr https://t.co/PO2blbSP78
Западные СМИ считают вступление Черногории в НАТО проигрышем России. Но была ли важна для Москвы победа в этой битв… https://t.co/MvD6dHAqCR
Кузнецова хочет наградить девочку из Тувы, которая прошла 8 км по тайге за помощью больной бабушке… https://t.co/H9lmaumseV
Коллектив Исаакия просит президента приостановить действие закона, позволяющего передать собор РПЦ… https://t.co/FayTPzqygP
Голосуйте за сборную, которую вы бы больше всего хотели увидеть в России https://t.co/aKACDxzsw8 https://t.co/CC6tX24vPr
Президент Ливана упал перед церемонией фотографирования на саммите ЛАГ https://t.co/brApBFir4V https://t.co/hCjEyFzhRD
Мосгорсуд отменил арест дома информатора WADA Родченкова https://t.co/uYGYWXKviw https://t.co/q0L06TAqNv
В Вашингтоне около Капитолия произошла стрельба, сообщили СМИ https://t.co/wNX6KWRpw3 https://t.co/IKcR6AAMdq
Зовут нас коренные…. Форум малочисленных народов Севера в Салехарде. Фотолента ria.ru https://t.co/W9SoZCLsxp https://t.co/9ZafgxXyXD
В посольстве США рассказали, зачем звонили организатору мятежа в Турции https://t.co/KDSvxPMznd https://t.co/AmZBgdiSrK
Публикуем цитаты из книги Стейнбека "Русский дневник", сломавшей стереотипы американского читателя о жизни в СССР… https://t.co/OXczzLcOtf
Директор Эрмитажа Пиотровский прокомментировал арест своего заместителя https://t.co/MjLINZ6SuD https://t.co/I96keroucr
В Магадане стая собак вновь напала на ребенка https://t.co/22BUNydwo1 https://t.co/koPCeV99FW
Меркель рассказала, при каком условии готова покинуть пост канцлера https://t.co/65G46JugiD https://t.co/BjLKh55Ep1
Синоптики пообещали, что в выходные в Москву вернется весна https://t.co/2QSI9oWMR1 https://t.co/tIQkWQSlGv
Головной фрегат "Адмирал Горшков" передадут ВМФ летом https://t.co/2G6MJj2BNV https://t.co/VYvdXEGVpy
Китайские болельщики не верят в "страшилки" о российских фанатах на ЧМ-2018 https://t.co/xAOPASaKxB https://t.co/bU2RbGQb7I
В Польше призвали не спешить с обвинениями в адрес России из-за обстрела консульства в Луцке… https://t.co/5HhB6JbEv8
Робота научили распечатывать и сжигать твиты Трампа https://t.co/v93kxIpWKv https://t.co/xOqQpZiNbw
Уйти по-английски: какую цену придется заплатить Великобритании за выход из ЕС https://t.co/wgyavueWfa https://t.co/gBJRKcDzQe
Музей в Бородино передаст РПЦ здания Спасо-Бородинского монастыря https://t.co/DsAeS8YpfP https://t.co/YEGMA0IlYA
Трамп обвинил СМИ в "злобном и неточном" освещении действий его администрации https://t.co/Tm0XncQXP7 https://t.co/GdezkWtK3w
Россия разрабатывает первую в мире гражданскую атомную подлодку https://t.co/LWJaKeBH1y https://t.co/OPo9QPtSKc
Глава МВД предложил уничтожать контрафактный алкоголь без решения суда https://t.co/HIZiH07Lpj https://t.co/c0PAgMqCQG
В ливийском Тобруке семья погибла при падении истребителя на их дом https://t.co/UtTLNwSPMy https://t.co/HYXjtYzvaq
29 марта 1886 года полковник Пембертон разработал рецепт «кока-колы». Несколько фактов о не самом полезном напитке… https://t.co/tYFoxcF12x
Житель Петербурга поджег автомобиль бывшей девушки после отказа помириться https://t.co/VuFOB4Rz0C https://t.co/yF507iw8qn
СМИ: антикоррупционное бюро проводит обыски в Нацбанке Украины https://t.co/RZwcqBdiYs https://t.co/efFHIrZBPT
Москва вспоминает жертв терактов на "Парке культуры" и "Лубянке" https://t.co/anj4FjoC0m https://t.co/MSvMvqzRSy
Берлин посоветовал призывающим к бойкоту ЧМ-2018 отделять спорт от политики https://t.co/YUMU2kYtCD https://t.co/YST85UywOz
Матвиенко после воскресных акций заявила, что "нельзя делать вид, что ничего не происходит" https://t.co/OYJg58xymS https://t.co/5fXZ1cFWEq
Протесты китайской общины в Париже - в фотоленте ria.ru https://t.co/j462X3W8KK https://t.co/6FmSwXKxqU
КНР движется к технологическому доминированию - китайские компании вкладывают млрд долларов в западные стартапы… https://t.co/sJnVN2uZQG
Киев получил ноту протеста от МИД Польши после обстрела консульства в Луцке https://t.co/OiRlwdMylP https://t.co/biY6wK3q3i
Захарова прокомментировала призывы немецких политиков бойкотировать ЧМ-2018 https://t.co/wzJh9FmEOp https://t.co/o19RO5iC6q
EBU пригрозил лишить Украину "Евровидения" из-за недопуска Самойловой https://t.co/GOUryoZFlI https://t.co/0AAlyJHIMM
Марианна Максимовская займется коммуникациями в Сбербанке, сообщают СМИ https://t.co/m611v4WUU7 https://t.co/s7eRqqfk9n
Организатор мятежа в Турции контактировал с консульством США, сообщают СМИ https://t.co/uiVnYn996z https://t.co/LqGpTbM4D0
В Латвии депутату, отказавшемуся "кормить" Россию, предложили жить в холодной квартире и не есть горячую пищу… https://t.co/QmDiAGV4gl
Англичанин с помощью кусочков бумаги преобразует здания в самые разные предметы и делится этим в своем Instagram… https://t.co/Ynclo8TO0o
New Republic: поиски "руки Москвы" превратили западных журналистов в конспирологов https://t.co/9d3SO0Czxl https://t.co/KUWbnimXep
Защита Навального обжаловала его арест на 15 суток https://t.co/PtXb7ScYBO https://t.co/N4uhVGoqeq
Георгия Матюшкина освободили от должности уполномоченного России при ЕСПЧ https://t.co/87nM5Jj4mD https://t.co/IwOFKo01Du
В Екатеринбурге учительница заставила матерившегося мальчика мыть рот с мылом https://t.co/wMVhVb2RvD https://t.co/uqi5SOlqR4
Виктора Нилова сняли с поста главы ГАИ https://t.co/3GiY7szh2P https://t.co/idUtL1a9oQ
Захарова ответила на заявления Киева об обстреле консульства Польши в Луцке https://t.co/uNPlEWIMek https://t.co/Si5MmseH4p
Великобритания официально уведомила Брюссель о своем выходе из Евросоюза https://t.co/P81MlTlFUS https://t.co/hiHjFdovUH
В Москве 700 учеников эвакуировали из школы после сообщения о бомбе https://t.co/WYvvya9ZPm https://t.co/6FVffyf5nE
#РИА_Видео В Аргентине нашли светящихся лягушек https://t.co/ywGRUCJjPW
Боевое братство: как прошла встреча Путина и Роухани - в материале ria.ru https://t.co/S5QzW3iRVU https://t.co/bjxCYrrlza
В Подмосковье мужчина ударил ножом в живот кричавшего под его окном подростка https://t.co/AFKJN8YfmI https://t.co/6sRzIMrQfR
На Украине объявили в розыск еще одного российского генерала Шадрина https://t.co/jZCzm7GnhN https://t.co/LwphOxhz9p
Жительница Смоленска под видом сотрудницы ГИБДД похитила 1,5 млн рублей у 16 человек https://t.co/OsrF6QELqV https://t.co/j4yqe483Yy
Старшина присяжных выбыл из процесса по делу Немцова https://t.co/JoEGExKhrh https://t.co/gkKVfxAK20
В Новосибирске продавец цветов секатором отбилась от грабителя с "розочкой" https://t.co/XPqlZSMKz2 https://t.co/XL9uFOWxGQ
В МИД прокомментировали высказывания посла Испании в Киеве о невыполнении Минских соглашений… https://t.co/47trYqrI2U
В Москве госпитализировали семь детей после ДТП на Варшавском шоссе https://t.co/ZzRwC4EXnd https://t.co/UzwICOmnUD
Генпрокуратура Украины завела дело по статье "теракт" после обстрела генконсульства Польши https://t.co/ONDODquxe4 https://t.co/6CfvedvtIX
#РИА_Видео ФСБ изъяла у торговцев оружием более 90 кг взрывчатки и автоматы https://t.co/U2JLYBtFSf https://t.co/DXuZqccz1z
Создатель комиксов обвинил Стивена Кинга в плагиате и потребовал $500 млн компенсации https://t.co/CPI3j1N9En https://t.co/VI9lHujspm
Головной атомный ледокол "Арктика" сдадут "Росатому" в мае 2019 года https://t.co/WiAVGDs0N9 https://t.co/7jYsXyrrdw
В Индии страдающую от жажды кобру напоили водой из бутылки https://t.co/32lgn7lww2 https://t.co/1Qh5qmKNVM
В российской армии появились военно-полевые супермаркеты https://t.co/MPMtwSrfch https://t.co/QfyKRI7q57
ФСБ и спецназ проводят обыск в центре саентологов в Подмосковье, сообщил источник https://t.co/BqFvyAsbNl https://t.co/GnRHMDPgYP
Совфед одобрил закон об уголовной ответственности для дебоширов на общественном транспорте https://t.co/C084Lit2Ll https://t.co/u22DYMmtsp
#РИА_Видео Тигрица Фрося кормит своих новорожденных малышей в крымском сафари-парке https://t.co/S1v1qGn5Jo https://t.co/IgdFs7UIJ3
Компания Трампа обращалась к олигархам из России и бывших стран СССР, сообщают СМИ https://t.co/g1QTeHbDlQ https://t.co/gK3MwqkBGq
России удалось устранить влияние санкций на строительство атомных ледоколов https://t.co/UvrCKSWfDh https://t.co/xCu2TqWVnu
В ДТП с микроавтобусом на юге Москвы пострадали трое детей https://t.co/LRIFIPEoqN https://t.co/EPrGeYlHqP
#РИА_Видео Двухлетняя девочка из Армавира получила "дизайнерский" протез руки, напечатанный на 3D-принтере https://t.co/xcxQMZzW7o
WSJ: расследование "вмешательства" России в американские выборы зашло в тупик https://t.co/OWfknhczAF https://t.co/lSN3RMzCvr
В Польше после обстрела консульства в Луцке вспомнили "российскую агрессию" https://t.co/ySqweqwWS5 https://t.co/OAIcMhLZTr
Максакова будет добиваться заочного суда над Вороненковым https://t.co/yrfYBmuMQ8 https://t.co/dFDak9El2n
#ВеликаяРусскаяРеволюция С таким же успехом они могли потребовать от русских ходить по воде или двигать горы… https://t.co/OijCvkNt2M
На Украине обнаружили самолет Ан-2 с перебитыми номерами https://t.co/1ARxf17IAN https://t.co/YoXtTEhPel
Милонов считает запрет на въезд на Украину похвалой и добрым знаком https://t.co/9XGlrJnbqD https://t.co/FfBiq27J0k
Почта России хочет использовать дроны для доставки отправлений https://t.co/nwXhWjY8BR https://t.co/IE1M9WmU4c
Мосгорсуд подтвердил законность заочного ареста экс-депутата Вороненкова https://t.co/ppxViLRZqv https://t.co/9Xt2MXx8ks
В Турции арестовали одного из главарей ИГ, сообщают СМИ https://t.co/OVdAsBXclZ https://t.co/9ugNcZIN6E
Высокий суд Лондона рассмотрит дело по долгу Украины перед Россией в ускоренном порядке https://t.co/c4PfNVZRlh https://t.co/3B949M4b8J
#РИАрхив https://t.co/e8JIWUaBXs
Неизвестные разбили окна в отделении "дочки" Сбербанка в Луцке https://t.co/6IxLrr4f9Y https://t.co/5m0eF6yrR9
Илюмжинов заявил, что не уйдет с поста президента FIDE из-за санкций США https://t.co/05n4XWOlPa https://t.co/dat4YRntsR
ФСБ разоблачила ячейку террористической группировки "Хизб ут-Тахрир" https://t.co/EDvNXARi0O https://t.co/vh9WwkX1u0
Вороненков незадолго до убийства пожаловался в Мосгорсуд на угрозы в свой адрес https://t.co/1qFYGLJtbS https://t.co/6eE820Fstn
Ryanair: Британия после Brexit может остаться без авиасообщения с Европой https://t.co/2PBm9nXQEt https://t.co/43dC3EK8w5
Депутату Милонову запретили въезд на Украину https://t.co/0pBtIAjbgc https://t.co/2X4ijcHw4e
Консул Польши назвал терактом обстрел диппредставительства в Луцке https://t.co/S7z6ofEGYg https://t.co/g4BxgUfTMa
Парикмахера в Кемерово осудили за покупку часов с видеорегистратором https://t.co/TafNZ1iyfz https://t.co/1XwYdfqyzP
СФ одобрил закон о запрете переводов на Украину через международные системы https://t.co/99oQOeumW2 https://t.co/qJ8naX2Cw3
Климкин назвал обстрел польского консульства в Луцке провокацией https://t.co/zlgJYjrFeA https://t.co/4PI9fEHhj2
Мизулина предложила не рассказывать школьникам об уровне коррупции в России https://t.co/WzRfIuh7Qp https://t.co/sDRsH8IfAU
Росгвардия ответила на обвинения в неготовности бойцов в Чечне к атаке https://t.co/mT8SZlZDV6 https://t.co/3VjDrNslwh
Россия ограничила поставки живой птицы и яиц из Чехии https://t.co/WR1WlG7z3U https://t.co/I9YSIZOoKa
Вертолеты России представят Ми-8АМТ в арктическом варианте https://t.co/3H5d7JJ690 https://t.co/Z4KFz1NoqW
Власти китайского Ханчжоу запретили холостякам покупать вторую квартиру https://t.co/CUBbHqz4Ze https://t.co/ph51KC2zB2
#РИА_Видео Подушки "Gentlefan" и объятия – как встретили футбольных фанатов из Бельгии в Сочи… https://t.co/rTpvKYLx5P
Чем закончилась рядовая погоня за водителем BMW в Ставропольском крае https://t.co/AGBwLTYB4r https://t.co/ffzc72usJh
В квартире бывшего главы Челябинской области проходят обыски https://t.co/IvDE5upTrO https://t.co/hpPDVN2Kw0
МИД Польши вызвал посла Украины после обстрела консульства в Луцке https://t.co/HsHughAsVZ https://t.co/LgXPb3oLGX
Нафтогаз подал иск против ЕК с требованием отменить решение по газопроводу Opal https://t.co/sMplFWqVk9 https://t.co/Xi2HNgE8Gt
Черноморский флот провел ракетные стрельбы в Крыму https://t.co/QAvCt8yeB2 https://t.co/JuDOg897Ub
Польша опровергает выход из сил быстрого реагирования ЕС https://t.co/i0u35xWZMS https://t.co/p5se7dct7i
Киев готовится к "Евровидению": гостиницы вдвое подняли цены https://t.co/DYRBem5C0v https://t.co/3DC5GDOpNE
В Иркутске предложили создать Музей Русской Америки https://t.co/d3CmapPV7E https://t.co/O8v33Qjny9
