Фийон заявил, что Францию ждёт экономическая судьба Греции: https://t.co/Ziz7LMia7Z https://t.co/JGusN1nuEf
Задержан участник нападения на часть Росгвардии в Чечне: https://t.co/ljSj5uQNGW https://t.co/chez7jQQ5H
RT @liferu_family: Тупой юмор или отсталость взрослых: над чем смеются подростки: https://t.co/K6aIpYKLY8 https://t.co/wVLzD0l35R
Жители Магадана пожаловались на массовый отстрел собак по всему городу: https://t.co/jkj139AVCV https://t.co/ykMQV8UA9Q
МИД Великобритании заявил, что не отдаст Гибралтар Испании после Брексита: https://t.co/8gPFzRsReW https://t.co/mHK38D27cC
В Атлантическом океане пропало судно с более чем 20 моряками на борту: https://t.co/NxLrszcWX1 https://t.co/ZieZpdMkx7
Если учить жить молодых "правильно", то это разрушит их жизни: https://t.co/DwiYQxkTnx https://t.co/StFEFnmZaG
Я вырастил дерзкого, но справедливого пацана Отец убийцы Вороненкова: https://t.co/jyKKHKti4S https://t.co/Pzn0xBLBhD
RT @sport_lf: "Барселона" выложила видеозапись с 15-летним Месси: https://t.co/cu4hBZHFD7 https://t.co/TkSG0t5E1n
ВСУ сорвали работы по разминированию донецкой фильтровальной станции: https://t.co/Fmi7scgi0b https://t.co/fuU24GLnNK
Почему не надо целовать покойников и надевать бриллианты на похороны: https://t.co/o4gpADIf6Z https://t.co/iWYS5FyeCT
В ДТП под Омском пострадали 12 человек, погиб ребёнок: https://t.co/9GuoxUzzi2 https://t.co/ZfI5Teq9K4
Европейские учёные "нашли" на Марсе древний ускоритель элементарных частиц: https://t.co/dsXPMrFQKa https://t.co/h6boAMS1hj
Житель Югры обнаружил гнездо с птенцами под капотом КамАЗа Смотрите видео на сайте: https://t.co/Ch96JTauFd https://t.co/qASc2CEjW7
В Москве обокрали звезду "Дома-2" Викторию Романец: https://t.co/OO8zIK4Sm6 https://t.co/YDVA1YoELk
Циклон "Дебби" затопил аэропорт в одном из австралийских городов: https://t.co/9TuHrXEzMe https://t.co/cQk7OKwNTL
Волонтёр заявил о гибели трёх киевских силовиков из-за взрыва миномёта ВСУ: https://t.co/j5rNH9Z5Fh https://t.co/xCBysi1K6y
RT @liferu_family: В Новой Зеландии берут под контроль секс между "училками" и школьниками: https://t.co/gT9IGrbcZ2 https://t.co/PswBz5YS49
RT @lflongread: Кто же придумал День дурака? Об этом спорит не одна страна: https://t.co/mfB8jAVESm https://t.co/c20Q4HkakV
МИД России на 1 Апреля представил автоответчик с заказом услуг хакеров: https://t.co/2URvPJ3w9U https://t.co/gOfV7A48kt
Меркель посоветовала беженцам не задерживаться в крупных городах, а ехать в деревни и сёла: https://t.co/uyaHRKo1h0 https://t.co/SOavx8KfNf
Бородатые шутки уральского "Шарли эбдо" Какой была политическая сатира 110 лет назад: https://t.co/dtg2WxgAT5 https://t.co/4fKhVRE2qa
Стинг хочет спеть гимн Украины перед боем Кличко: https://t.co/iRIsMYOmYB https://t.co/JEGYVyOiaa
В Коми 7-летний мальчик умер после домашнего лечения: https://t.co/buBbG2w9pu https://t.co/NpoUR0LuDR
На Гавайях 10 женщин-заключённых обвинили тюремщиков в изнасилованиях: https://t.co/EctYSkVeSM https://t.co/uT0cEMznEf
ВСУ обстреляли ремонтную бригаду в районе фильтровальной станции: https://t.co/XLiND62nN4 https://t.co/f6LPMRNJsE
В Шереметьево экстренно посадили самолет из-за приступа у пассажира: https://t.co/jzzgV2w3j2 https://t.co/FbzC820VZy
В Татарстане задержали мужчину, избившего 12-летнего ребёнка из-за 17 рублей: https://t.co/DGGRwiX0j4 https://t.co/PZ41rzFGUW
На Курилах произошло землетрясение магнитудой 5,2: https://t.co/YJDeHrcgdo https://t.co/9fqwPwoQ9k
RT @lf_science: Вы откроете ссылку и скажете "ЧТООО" Но на самом деле это очень интересно: https://t.co/eCN0aoHquB https://t.co/GlvDv55phm
Тело погибшего Ким Чон Нама было доставлено в Пхеньян из Пекина: https://t.co/JAm5N8hTis https://t.co/SVksVUSFhU
Порнозвезда рассказала, что к ней приставал один из вдохновителей Брексита: https://t.co/wtWgKWw7Kf https://t.co/GVu0PpVdaC
В Подмосковье автомобиль протаранил машину скорой помощи, приехавшую на ДТП: https://t.co/T01sLvCWpF https://t.co/nNCdI6fBBV
Нейросетке показали лица звёзд и шедевры искусства Вот как она поняла их эмоции: https://t.co/HUmn5LBC9E https://t.co/wJQpJOyel9
RT @sport_lf: "Краснодар" собирается вернуть на историческую родину обоих братьев-близнецов Миранчуков: https://t.co/Y0J2DkyraJ https://t.c…
В Индонезии около 30 человек оказались под завалами из-за оползней: https://t.co/PpPnSI6wtv https://t.co/f3hM5ZdhE3
RT @lflongread: Чем отличается немецкий ужин от русского: https://t.co/HK7eymsEsc https://t.co/CnYUTX2RC8
МВД Ирака заявило, что жители Мосула погибли от атаки ИГИЛ, а не от ударов коалиции: https://t.co/Tn61H8ihON https://t.co/HglIGszV0y
Интернет-омбудсмен Мариничев заявил о необходимости признать криптовалюту в России: https://t.co/bEmHSUhNtQ https://t.co/nRLh3Kip0A
RT @lf_culture: Сегодня "Матрице" исполняется 18 лет Надо признать, что это — плохой фильм: https://t.co/ltOfrI5b20 https://t.co/rnkwOKRFiA
Песков прокомментировал заявления Навального о доходах Медведева: https://t.co/DEZmaXdwSR https://t.co/Y7N0t3ddKv
В США двое журналистов подали в суд на Дональда Трампа из-за того, что их по ошибке включили в список террористов:… https://t.co/b1VtWW1j7L
За прошедшие сутки ВСУ 86 раз обстреляли территорию ДНР: https://t.co/YWco41BMXO https://t.co/HrxnYZvNQ8
Лукашенко поздравил Путина с Днём единения народов: https://t.co/0figGd8fY7 https://t.co/AXJmTmdAHk
RT @lf_technology: Потерявшие от чувств голову люди — лёгкая добыча мошенников Как русские невесты обманывают иностранцев: https://t.co/JF…
Трамп забыл подписать указы и ушел из Овального кабинета: https://t.co/eVYdu1u1Xe https://t.co/CGNCDCdXbS
RT @lf_goodnews: Выживший в пожаре котенок обрел новое имя Теперь он - тёзка Хью Джекмана: https://t.co/CYT7ZcU6yE https://t.co/LM5vHkVz0H
Пранкеры разыграли Юрия Лозу: https://t.co/MPb2KPhcOr https://t.co/qPrxWwNCti
На месте загоревшегося рынка в Махачкале запланировано строительство крупного ТЦ: https://t.co/LFQwvexQkR https://t.co/8HSZJPOSPH
В Якутии студенты оседлали памятник ВОВ: https://t.co/gOrPzY5XJh https://t.co/os6uiY6Bjq
Актуальные новости к этому часу https://t.co/BOjSfTiidJ
Второй за сутки выброс пепла произошел на вулкане Ключевской на Камчатке: https://t.co/VTRJDafPq4 https://t.co/Y1jIL5k9KM
СМИ: Индиец поджёг себя из-за песен жены на свадьбе: https://t.co/L8Jj16qkYI https://t.co/TFqvtaZmCw
NYT: Состояние дочери и зятя Трампа оценивается в $740 миллионов: https://t.co/itnDrdIkxv https://t.co/YZPfNUIPjl
Парень перепутал города и улетел в канадский Сидней вместо австралийского: https://t.co/1ItLPAvhMt https://t.co/CVTGJSauwJ
Коленька-Коленька, ты такой убогонький. В Самаре студент спел на выступлении губернатора: https://t.co/B065FZHcej
В США приговорённый к казни за убийство 13 военнослужащих объявил голодовку: https://t.co/7s9M42DNYc https://t.co/zk62KVVogu
Рыбак из Флориды отбился от аллигатора с помощью ножа. Видео на сайте: https://t.co/Tl3QFoKZTW https://t.co/GbBKm24hQi
??Курс валют на сегодня?https://t.co/YGyGFEQ7iZiZ
На Tattoo Expo 2017 выбрали татуировку, которую стоит удалить как можно быстрее: https://t.co/j7D8n0l0qo
Боевики "Боко Харам" похитили 22 девушки из нигерийских деревень: https://t.co/dojJjMvbwl https://t.co/4DUL1wRPjM
Песков обвинил американские СМИ в ведении антироссийской пропаганды: https://t.co/uJYDbu4BSu https://t.co/9wV3vU6uhP
Ким Чен Ын похвалил своих танкистов за способность сметать всё на своём пути: https://t.co/1yRrIWZgtc https://t.co/RNDBl1eCi3
RT @lf_goodnews: Пропавшая собака вернулась к хозяину спустя четыре года: https://t.co/3dK5mcuuE4 https://t.co/vxcjqtTJqD
Песков заявил, что отношения РФ и США могут стать хуже, чем во времена Холодной войны: https://t.co/H00PaGMy3K https://t.co/azMFIB8zic
Fox News раскрыл личность человека, рассказавшего о прослушке Трампа: https://t.co/HsItbHxChg https://t.co/xuvYOPcSzY
Кличко задекларировал девять велосипедов: https://t.co/sYvo5qNScQ https://t.co/DsCItf4M6x
В столице Парагвая участники протеста подожгли здание конгресса: https://t.co/RzTiNQESvT https://t.co/jTM2dv7OiM
США стали новым председателем Совбеза ООН: https://t.co/qfpWXlhSt3 https://t.co/dbQtrcoxyj
ИГИЛ в соцсетях предупредила о планируемых террористических атаках на Париж: https://t.co/DaDSYdqAOL https://t.co/cnZ9DppQI7
Покупатель случайно написал продавцу, что хочет его ограбить: https://t.co/utPJfOc7yo https://t.co/QObVAWL0wN
На 66-м году жизни умер автор радужного ЛГБТ-флага: https://t.co/BTCawhAnD1 https://t.co/OiwoKfdyIZ
За 2016 год Порошенко заработал более 450 тысяч долларов: https://t.co/L9dlbdfqVj https://t.co/4Huc8CA7KX
Белый дом начал раскрывать доходы своих сотрудников% https://t.co/H496UQgKiz https://t.co/HuvMU503Js
Виновник техасского ДТП, в котором погибли 13 человек, перед аварией писал СМС: https://t.co/YdmplWYIIo https://t.co/KDpwEUBpKI
Чешского посла в Швейцарии и Лихтенштейне снимают с должности из-за твитов жены: https://t.co/eH1ZeFSvNj https://t.co/wSbgnPnmSC
У ИГИЛ появились устройства, позволяющие проносить взрывчатку в самолёты: https://t.co/GOGcwTmiGh https://t.co/1qb7x1M72P
Илон Маск назвал примерную дату первого запуска сверхтяжёлой ракеты Falcon Heavy: https://t.co/KjnI8IJZMP https://t.co/DkqvHavKmC
RT @sport_lf: Фанаты "Наполи" перед матчем с "Ювентусом" скупают туалетную бумагу с Игуаином: https://t.co/htBQuCjp5u https://t.co/atBrQonz…
RT @sport_lf: Жена Тимощука поддержала идею лишить футболиста звания почётного жителя Луцка: https://t.co/lVdC4fv6m6 https://t.co/yYempgwSLc
В США продали бывшее казино Трампа: https://t.co/VnkSuq1edx https://t.co/ztMLiztrEd
89-летняя баба Лена из Красноярска, которая путешествует по миру на заначку с пенсии, прилетела в Доминикану: https://t.co/6ADrLXMvBb
СМИ: Ким Чен Ын тратит десятки тысяч фунтов стерлингов на зарубежный алкоголь: https://t.co/HaKNzbH1hW https://t.co/jHhoYBJiIX
Грушко сообщил, что НАТО не готово обсуждать проблему транспондеров на экспертном уровне: https://t.co/HNLHNH3i72 https://t.co/qKOmKBjQOu
Осуждённого за шпионаж россиянина отпустят за примерное поведение: https://t.co/lTnZshymBb https://t.co/aggnTJkK01
Предполагаемый виновник ДТП на Новой Риге скрылся: https://t.co/3a1JnHJk5h https://t.co/XskpkbGAif
Полицейского приговорили к 40 годам тюрьмы за убийство шестилетнего мальчика: https://t.co/oKF3XbSFka https://t.co/dNVoJqG4Pg
Парень сделал фальшивое предложение подруге, чтобы получить бесплатный десерт: https://t.co/GXToaxLjfN https://t.co/8u7TLY9NdB
Fitch подтвердило кредитный рейтинг России на инвестиционном уровне "BBB-": https://t.co/CYI29mYYX7 https://t.co/MdfuE5Ro2v
Белый дом напомнил американским СМИ о подозрительных связях Клинтон с Россией: https://t.co/DdF893qmlS https://t.co/jec1zAIQcB
Ляшко: Правительство Гройсмана — Порошенко встало на защиту кучки олигархов: https://t.co/NPXKdB3SuB https://t.co/UeG9Gxqi9N
Под Ростовом-на-Дону произошло массовое ДТП: https://t.co/Q6pn7pTBC5 https://t.co/nKk42C8ZtM
Глава Пентагона назвал Россию стратегическим соперником Запада: https://t.co/V9Ax68KRVL https://t.co/SS5lLSlsTa
? Главное за день - 31.03.2017 https://t.co/dRoCeanlUE
В Кувейте женщина снимала горничную-самоубийцу на видео вместо того, чтобы спасать — шокирующее видео на сайте:… https://t.co/K7kIarv5Fw
Брюссель поставил Лондону условия для свободной торговли после Brexit: https://t.co/vkyBkftJDc https://t.co/OsBcCJTqmf
RT @sport_lf: Фигуристка Евгения Медведева защитила звание чемпионки мира с двумя рекордами: https://t.co/tIoJ6aKB7t https://t.co/th29XD7wzO
Порошенко признался, что ждёт от Европы плана Маршалла для Украины: https://t.co/TktQ5B8kB7 https://t.co/clxAyJGvJr
В Белом доме заявили, что смирились с реальностью правления Асада в Сирии: https://t.co/sGWEpaSC4H https://t.co/cynnJE5NLh
Мерседес протаранил семь машин в Подмосковье: https://t.co/EE5Fyh9j5H https://t.co/Vt1T55yETx
Twitter заменил яйцо на силуэт человека на профилях без фотографии: https://t.co/oDsCEoYoSq https://t.co/oG3sjtxhLs
В Австрии стали в два раза чаще нападать на приюты для мигрантов: https://t.co/n3yOs93CqC https://t.co/4f7mRhWg4T
По заявлению МИД РФ, высказывания Тиллерсона о "российской угрозе" вызывают недоумение: https://t.co/FllWzIwxvy https://t.co/qMw8TozC0r
Участниц Comedy Woman пустили на Украину несмотря на то, что они посещали Крым: https://t.co/1a1sKdIEBZ https://t.co/Igqn2I7k1y
При стрельбе в Москве ранены прохожие, защитившие женщину от ограбления: https://t.co/h8ezZeUAuA https://t.co/dtG1lUYFyp
Обнаружен автомобиль преступников, открывших стрельбу в центре Москвы: https://t.co/n4gxcfWPtm https://t.co/O1x5RbTX6d
В центре Москвы случился еще один случай ограбления со стрельбой: https://t.co/iLPl1nyXVz https://t.co/frFqMMwE8S
В Берлине стокилограммовую монету за $4 млн похитили при помощи топора и тачки: https://t.co/fVvj4V1MmJ https://t.co/4OO9kpvZHP
Поэт Евгений Евтушенко срочно госпитализирован в США: https://t.co/GfFVCMvdUn https://t.co/UXKstbrONK
Вокалист System of a Down объяснил, почему стал наблюдателем на выборах в Армении: https://t.co/5SFAOMIj4Q https://t.co/i6RDVXlceD
У раненого после стрельбы в Москве забрали сумку с 3 миллионами: https://t.co/LMQdbhevIV https://t.co/xpTU3bmzHL
Дмитрий Медведев назначил Сергея Калугина заместителем главы Минкомсвязи: https://t.co/YbxdqwWCgd https://t.co/57ifRs1xd7
В США предложили ввести новые санкции против России: https://t.co/ejFs7ZO3Vv https://t.co/dZM4Y49ixo
В центре Москвы расстреляли человека: https://t.co/TWxqjgcVlH https://t.co/cMfrnZgIjv
RT @liferu_family: Что делать подростку при встрече с маньяком: https://t.co/vOfFPm2ckA https://t.co/uEQIJWSOwE
Актуальные новости к этому часу https://t.co/MS2m1zP3ik
На фиолетовой ветке московского метро увеличены интервалы движения поездов: https://t.co/6cxst1yvyj https://t.co/YW7gQnpcGc
Вестибюли нескольких станций столичного метро закроют в выходные: https://t.co/vTbpTYhiB3 https://t.co/0jvhToPBUM
Из Германии в Москву экстрадировали обвиняемого в убийстве россиянина: https://t.co/eTYBfCISWE https://t.co/SJ4mJmJvGJ
Мем с лягушонком Пепе заменил венесуэльскую валюту: https://t.co/2ToIJlttDi https://t.co/0b59uqFLLu
Не плачь по мне, Украина! - Артемий Лебедев ответил СБУ на запрет на въезд: https://t.co/MzLqYqkdDF https://t.co/1jDbdggpIj
На Украине хотят запретить ввоз российских лекарств: https://t.co/ScufLOSker https://t.co/caGdE7bXPl
Авиакомпания "Победа" планирует к лету обучить сотрудников самбо: https://t.co/BzdNyK8kR7 https://t.co/9EuTDhUUyU
Из-за обстрелов ВСУ в Донбассе снова разрушены жилые дома, школы и детские сады: https://t.co/kRUT3Hmib0 https://t.co/mEzHed2Xil
Студенческий стартап. От идеи до продукта: https://t.co/oDOkAEviBQ https://t.co/95C8ZjxJEn
Трёхлетний "человек-паук" из Ирана легко лазает по стенам Смотрите видео по ссылке: https://t.co/Ezezb2y84d https://t.co/6CQkjHelwP
В Новороссийске гружёный автовоз врезался в ж/д мост Больше фото на сайте: https://t.co/ArbdAHfOTA https://t.co/LtVnkxSES7
СБУ подтвердила запрет на въезд в Украину Артемию Лебедеву: https://t.co/Wzoisc2ieL https://t.co/8bSOEzUPZi
Убитый в Мариуполе полковник СБУ устраивал с "Азовом" зачистки и пытки Смотрите видео на сайте:… https://t.co/Zo8EaG41WZ
Как сообщает СМИ, Флинну отказали в иммунитете от преследования по делу о связях с Россией: https://t.co/pPzHNTct6k https://t.co/A5o1KGWt59
По заявлению биолога, украинская идея топить газом из водорослей города – чепуха, так как очень дорого:… https://t.co/4arWFD7YoX
В МГБ ДНР выдвинули две версии теракта в Мариуполе: https://t.co/7Xl86AnGXS https://t.co/m8IoUhfhj2
В США фанаты подрались после боя с участием армянского боксёра. Смотрите видео жестокой драки на сайте:… https://t.co/gTLEJ9adIK
Глава Еврокомиссии пригрозил Дональду Трампу тем, что поддержит выхода Техаса из США: https://t.co/RgzJgICmeW https://t.co/bvbIMAuMDY
RT @lflongread: Между законом Украины и здравым смыслом. Читайте о том, чего ждет от Киева Европейский вещательный союз: https://t.co/LbhUu…
МГБ ДНР опровергло обвинения Киева в причастности к теракту в Мариуполе: https://t.co/Bh9nyk3Fqh https://t.co/IyLVM114Pi
Учёные доказали, что лень заразна: https://t.co/6lkVmkC1dq https://t.co/us5nUtpDHb
МИД Украины заявил о невозможности уступок в отношении Самойловой: https://t.co/eF7rjivMSw https://t.co/suUPLnckWz
Байкер выложил видео заезда по тоннелю в Москве на скорости 250 км/ч Смотрите видео по ссылке:… https://t.co/IZLpXAJXXW
Полиция предостерегла от участия в незаконной акции в Москве 2 апреля: https://t.co/g9SHrInq1k https://t.co/pwKqzSPQBo
В Лондоне женщина предотвратила теракт, сдав полиции фермера-боевика: https://t.co/kvYTQ5tdOv https://t.co/vHLleLRP3A
Гендиректор военного завода "Салют" жаловался семье на проблемы с работой: https://t.co/2t2nbQEVJt https://t.co/VlD5vHyA46
В Германии Крым обозначили российским на карте в учебнике: https://t.co/s1xJwNUkdj https://t.co/Q9ccrFil7D
В Уфе няня накрывала ребёнка подушкой, чтобы он не мешал ей смотреть телевизор: https://t.co/prixrwYAUJ https://t.co/EHX9d8ESJH
RT @lf_culture: 31 марта 1889 года состоялось открытие Эйфелевой башни. За что французы не любят символ своей страны: https://t.co/EHrCkeyZ…
Савченко заявила, что Порошенко ждёт судьба Януковича в случае переизбрания: https://t.co/fIu3UnEq0t https://t.co/jk9FrD8MnK
Трамп высказал сожаление, что Флинну приходится просить о защите из-за "охоты на ведьм": https://t.co/ypJCelyKqa https://t.co/D8PZlzKxLs
Франсуа Фийон, вопреки своей позиции, назвал Россию опасной страной: https://t.co/LSctFjENXo https://t.co/DMpQJQtg7e
Депутаты Госдумы предоставили декларации о доходах: https://t.co/UmKSAQeOCT https://t.co/xuNebxW324
