Морозов: на атаку США в Сирии нельзя отвечать средствами войны, нужно воздержаться от резких ответных решений… https://t.co/byJBSsjYFB
Путин считает, что удары США по Сирии наносят урон отношениям с Россией https://t.co/Gq2byMR37b https://t.co/3N2IraLlpj
Удар США вывел из строя все самолеты на авиабазе в Хомсе https://t.co/UkZk3eZH6z https://t.co/ImT1i9hg02
Боевики ИГ напали на сирийские позиции одновременно с ракетным ударом США, сообщил источник https://t.co/23huxC8E4h https://t.co/IDzbzV7Sve
Си Цзиньпину и китайской делегации не хватило комнат в поместье Трампа https://t.co/xC3O0jgy7R https://t.co/Vxdp2ChUoK
Утренняя подборка новостей уже в нашем Telegram-канале https://t.co/QuxzNY2fbR https://t.co/iGjNAiOKkC
Путин считает удары США по Сирии агрессией против суверенного государства, сообщил Песков https://t.co/yOqddcl9ik https://t.co/d2vzsZkHWg
Пентагон опубликовал видео ракетного удара США по авиабазе в Сирии https://t.co/Kd47qO7qtU https://t.co/fWRCw2q5Kc
Советник Трампа рассказал, как США приняли решение о ракетном ударе в Сирии https://t.co/jk3dEaMuVT https://t.co/xyg8bk0ZFk
Британские власти поддержали удар США по базе в Сирии https://t.co/Zlq6HGs4A9 https://t.co/j2Wva2ASr0
Действия США в Сирии ведут к непредсказуемым последствиям, Трамп открывает ящик Пандоры, пишут греческие СМИ… https://t.co/auWevfnAsj
Губернатор Хомса сообщил о жертвах после удара США по авиабазе в Сирии https://t.co/bGeWXJcoEd https://t.co/2oKu63b3uE
#РИА_ДеньвИстории При катастрофе погибли 42 человека, 33 из них покоятся на дне Норвежского моря, и только 9 похоро… https://t.co/PrsDfLGTi0
Wintershall считает, что более выгодной альтернативы российскому газу для Европы нет https://t.co/xSeG0W4cyE https://t.co/Hrc8zBdo63
В Уругвае в июле марихуана поступит в свободную продажу https://t.co/hwgCq99IVm https://t.co/l0ihixYWzm
Пилотов-заочников не пустят за штурвал пассажирского самолета, пишут СМИ https://t.co/X261ao1Mgu https://t.co/IyrlgJPuRz
В Сирии рассказали, что авиабаза, атакованная в США, играет основную роль в поддержке армии в борьбе с ИГ… https://t.co/I6ZLalbkJr
СМИ сообщают, что сирийские военные перед американским ударом эвакуировали персонал https://t.co/rXSkgiDliS https://t.co/mEBFNgfcsm
Россия потребует созвать Совбез ООН после американского удара по Сирии https://t.co/gImUbQxPUS https://t.co/UKPIxEjYQq
В Совфеде заявили, что нанесение США ракетного удара в Сирии может подорвать усилия по борьбе с терроризмом… https://t.co/Vtjxi9So8Y
Число пропавших без вести в Мексике увеличилось почти до 30 тысяч человек https://t.co/TCjoH9sAwB https://t.co/aOsAjrUdjQ
Сирийская армия использовала базу, по которой ударили США, в борьбе с ИГ https://t.co/J6rN2U5P2k https://t.co/mexuGdKk4Y
Американский военный назвал удар по Сирии единичной операцией https://t.co/crFLcMboiL https://t.co/vLFYOoCrrG
Россия планирует сделать заявление из-за американских ударов по Сирии https://t.co/K0sJ3P9p0E https://t.co/81n8BXBrh3
В американском сенате раскритиковали приказ Трампа об атаке в Сирии https://t.co/RUkAOTIl2R https://t.co/yrbDECwTYI
Губернатор Хомса рассказал, что на сирийской авиабазе уже более 2 часов продолжаются спасательные операции… https://t.co/C66eSp0byJ
Пентагон сообщил, что в результате американского удара в Сирии нанесен серьезный урон https://t.co/IgEDrCgsEV https://t.co/H910NlACW4
Трамп лично информировал Си Цзиньпина о ракетном ударе США по Сирии https://t.co/4NbVhmx4OC https://t.co/mliN1WXSyO
В США заявили, что старались избежать жертв среди российских военных в САР https://t.co/y6gjT3AmTd https://t.co/39gQJcGcWz
Трамп призвал мир помочь покончить с резней и кровопролитием в Сирии https://t.co/ttU4Prpk6B https://t.co/NevQDhYWc3
США не просили согласия России на ракетный удар по базе в Сирии, сообщил Тиллерсон https://t.co/5tahzmvhuC https://t.co/T3PJOG8jX4
Пентагон утверждает, что на атакованной сирийской базе было химоружие https://t.co/7MVJU6nHe0 https://t.co/dCC8lKrXAo
Губернатор Хомса заявил, что американский ракетный удар служит целям "вооруженных террористических группировок"… https://t.co/81sO8oq4Y3
Тиллерсон обвинил Россию в невыполнении соглашения о ликвидации химоружия в Сирии https://t.co/63sNhxDlS5 https://t.co/OTFnOMLOgf
В Пентагоне сообщили, что не наносили удары по тем частям военной базы в Сирии, где могли находиться ВС России… https://t.co/4tZzKUSdg5
США предупредили Россию о нанесении удара в Сирии, заявили в Пентагоне https://t.co/PHcQZukhFL https://t.co/heZSfAor7C
Сирийский источник сообщил о потерях из-за ударов США по авиабазе https://t.co/XzVGMjs9NB https://t.co/U8KjsnqVSU
Трамп заявил о провале попыток изменить поведение Асада https://t.co/HBurLLO2Kv https://t.co/O0eOuBr8kX
США выпустили более 50 "Томагавков" по целям на сирийском аэродроме https://t.co/hRkEQA3DIp https://t.co/qOLJDXgtQx
Сирийское государственное ТВ назвало "агрессией" американский удар https://t.co/XvhKIybPoY https://t.co/BP207yb4Ih
Трамп заявил, что удар по Сирии отвечал "жизненым интересам" США, пишет Fox News https://t.co/XAzst5son0 https://t.co/M8m6vBXHrT
Трамп рассказал об отданном приказе атаковать сирийский аэродром https://t.co/5QHOv2AN9m https://t.co/5f2qRPqpq3
CNN назвал целью американского ракетного удара по Сирии аэродром Шайрат в сирийской провинции Хомс… https://t.co/ZeoUzGYAxU
Удар США по Сирии был нанесен ночью между 3-4 часами по московскому времени https://t.co/DfwxxDTxoZ https://t.co/aMtDw3AZga
Трамп обратится к американцам из-за ракетных ударов по Сирии, сообщает CNN https://t.co/BpuGNLwPgk https://t.co/cd1IcgrleC
ВС США завершили ракетный обстрел правительственной базы в Сирии https://t.co/oANd7qq4Ko https://t.co/hVhXTBvOPF
NBC сообщает, что США нанесли удар по базе правительственных войск в Сирии https://t.co/vVpxJ7pBam https://t.co/Ekn2zxwef5
Зампостпреда России при ООН рассказал, что Запад не приветствует предложенный проект резолюции по Идлибу… https://t.co/TSjXWmKc8z
Twitter подал в суд на власти в США, требующие раскрыть данные пользователя https://t.co/NTISM9cAV2 https://t.co/4VeJzxbXCB
В ЛНР назвали блокаду со стороны Киева признанием независимости республик https://t.co/gywcX2lqyI https://t.co/P1J9N31nhG
Клинтон призвала США разрушить военно-воздушные силы в Сирии https://t.co/9yl6EdiELX https://t.co/6GGU87D2Ps
В Венесуэле два десятка человек пострадали в ходе оппозиционного марша https://t.co/hY9thALKlK https://t.co/Rn2aGkR1xn
Баскская группировка ЭТА объявила о планах по полному разоружению в субботу https://t.co/WQpjHpgejT https://t.co/fNOiD2V8YS
Клинтон дала понять, что больше не будет участвовать в выборах, пишет CNN https://t.co/EQl7RAuEvh https://t.co/m418Z24b2F
ВКС России уничтожили 35 тысяч боевиков в Сирии с начала операции https://t.co/Ur4axIrYJ5 https://t.co/2bBplIIfhR
Совбез ООН отложил голосование по проекту резолюции по ситуации в Идлибе https://t.co/I9GWCMaoY0 https://t.co/9yVblBMSfh
Допинг-проба олимпийской чемпионки из Кении дала положительный результат https://t.co/1tAAJZIzHK https://t.co/r05woVVbBX
Новая газета узнала, что Сбербанк не получит денег за продажу "дочки" на Украине https://t.co/6JkPN0m7D8 https://t.co/Gwgf4LL5fr
В МИД России заявили, что ИГ начало получать доходы от афганской наркоторговли https://t.co/Zn7w25Tygt https://t.co/m3AsPc1wCX
В Wintershall заявили, что Польша не смогла помешать реализации Nord Stream 2 https://t.co/nOxtaudOR5 https://t.co/AnhyKgCLbs
Россия предложила ввести эмбарго против территорий, подконтрольных ИГ https://t.co/iTfGSL2xnI https://t.co/A7Lwk4cZ9V
В Нью-Йорке призвали не подражать Трампу, признавшемуся в "зацепинге" https://t.co/soDXLllhiX https://t.co/bjmouqYdJg
Ученые узнали, что на планете Церера атмосфера появляется лишь во время солнечной активности… https://t.co/K9VsIkd3rC
Разведка США заявляет, что Асад не ликвидировал все запасы химоружия https://t.co/9OGUO3Wh5q https://t.co/LgsisydlWH
НАК назвал причиной подрыва предмета у школы в Ростове-на-Дону бытовой конфликт https://t.co/XAk3o1GSgx https://t.co/qVlZtUgAHo
В Республиканской партии предостерегли Трампа от удара по Сирии https://t.co/snGWR2E2dx https://t.co/HKt4Aw2PGE
Нетрезвый "борец с моджахедами" причинил ущерб на пять миллионов рублей https://t.co/VWGwF8eeZy https://t.co/zvGNEGWgMp
В Москве двух мужчин госпитализировали с огнестрельными ранениями https://t.co/AVRhfroAdd https://t.co/Ec2a6XfzkN
В ДНР назвали заказчика убийств Гиви и Моторолы https://t.co/MRc5vQmOdb https://t.co/5L3drr96F5
Цивилизация от Лиссабона до Харькова: Порошенко рассказал о "безвизе" https://t.co/A7y9AA0IMG https://t.co/yPQ1aP8DTN
Врача-анестезиолога нашли зарезанным в собственной квартире в Москве https://t.co/ggDwIS4JND https://t.co/odKu9YgiFJ
Семьи погибших при теракте в Петербурге получат примерно по 5 млн рублей https://t.co/3rWRAnmnwM https://t.co/URa55BlNvx
Биологи открыли целую семью гигантских вирусов-"франкенштейнов" https://t.co/xG96SOvjHG https://t.co/4dpEbkLdao
Военные эксперты отмечают, что в условиях сокращения финансирования ряд амбициозных проектов может быть отложен… https://t.co/z6rYmUU5gm
Россия скорбит: акции в память о погибших в петербургском метро прошли в городах России. Фотолента на Ria.ru… https://t.co/BlX9xaP33y
Астронавта Джона Гленна похоронили на Арлингтонском кладбище https://t.co/5AZzHxR45A https://t.co/BTqQNuuEuj
Трамп заявил, что готов к односторонним действиям против КНДР https://t.co/tJHqZu6cv8 https://t.co/2yVZ8SROvl
СМИ: в Киеве начинают собирать подписи за отставку Кличко https://t.co/4dlqwEzTLY https://t.co/00YlMVWb0s
Тиллерсон: Россия должна "серьезно подумать" о дальнейшей поддержке Асада https://t.co/DkCtaAX86V https://t.co/3N7MmAIEqZ
Вслед за металлургическими на Украине стали останавливаться и энергетические предприятия https://t.co/BcPlNnBSxK https://t.co/0yTvnKEmJf
В госдепе считают, что за ситуацию в Сирии несет ответственность Россия https://t.co/NJgXLucv07 https://t.co/MfYnD5jcFy
Тиллерсон в Москве поднимет вопрос о "вмешательстве" России в выборы в США https://t.co/w7ZyMQ9BuT https://t.co/7mffbFnGzG
#РИА_Видео В Петербурге прошел митинг памяти жертв теракта в метро https://t.co/4ouM1ZSAQj https://t.co/iteOnbfi6w
МВФ: экономика Украины достигнет уровня ЕС не раньше 2040 года https://t.co/aCmKYFJ9g5 https://t.co/i5MhjHcX6w
Депутат сейма сравнил Литву с пустыней Сахара из-за массовой эмиграции https://t.co/wrKDRf7MXr https://t.co/8C3AKmzLcE
Умер российский писатель и журналист Александр Гаррос https://t.co/qMdkZNMVsI https://t.co/vVKj5HHXJw
Вечер памяти жертв теракта в петербургском метро завершился в Москве https://t.co/364jc7qMl9 https://t.co/QuTt8h2oT1
В Индии нашли "девочку-маугли", жившую с обезьянами в лесу https://t.co/fb5TmJrIXc https://t.co/mibzGAZVm6
Что заставляет европейцев обращаться к политическим движениям, которые до недавнего времени считались маргинальным… https://t.co/cUKd1qNrQZ
WP: координатор ВКП призвал "уничтожить вооружение и авиацию Асада" в Сирии https://t.co/elp4z1AwND https://t.co/jhhITbH3qT
#РИА_Видео Шоколадный кролик: Playboy подготовил к Пасхе сладкий наряд для своего символа https://t.co/8xVKQ3RAzA
Следить за главными темами дня можно в нашем Telegram-канале https://t.co/w8eQOHlPTX https://t.co/qPdxNzGoAs
Эрдоган заявил, что Турция готова поддержать военную операцию США в Сирии https://t.co/uHZawBSyYx https://t.co/6BusPveNII
Москва пытается испортить отношения Украины и Венгрии, заявил Климкин https://t.co/GJEDVco2P0 https://t.co/FQM30bTGsk
Лукашенко объяснил, как Россия компенсирует Белоруссии высокую цену на газ https://t.co/cTDQ6NWwYL https://t.co/S9sj4JKppg
По делу о взрыве в метро Санкт-Петербурга задержали восемь человек https://t.co/5H0w7kggTz https://t.co/gjktCxYpR8
Жан-Люк Меланшон победил на предвыборных дебатах во Франции, но есть ли у него шанс оказаться во втором туре… https://t.co/mh4CwmZQs4
Ведущий @RT_com ответил на обвинения американского сенатора в адрес телеканала https://t.co/OLqtrNBdjI https://t.co/BRy6oMIuYs
#РИА_ФотоДня #ПитерМыСТобой https://t.co/ujLVWBzkoW
Эрдоган назвал Европу "загнивающим континентом" https://t.co/im2LpTEw5a https://t.co/i9r2h2aGcz
Минэкономразвития спрогнозировало доллар по 68 рублей к концу года https://t.co/9u2jHqSa02 https://t.co/LhoHlWr5ah
Две украинки попытались ввезти в Польшу шестиствольную пушку https://t.co/QOKuAseE08 https://t.co/8LtkpC4Wlz
СК задержал подозреваемого в призывах к беспорядкам в Москве 2 апреля https://t.co/C8kstSvGY4 https://t.co/pAtsZEJixT
Маленький принц стала самой переводимой в мире книгой после Библии и Корана – ее перевели на трехсотый язык… https://t.co/g5ZoJQPp5G
СМИ: Трамп рассматривает военные меры против Сирии после химатаки в Идлибе https://t.co/rSE9vR3Rt9 https://t.co/kXL9rjffap
Какую выгоду для России несет предстоящая встреча Дональда Трампа и Си Цзиньпина https://t.co/hmHAUg4WC0 https://t.co/gJL0u7EPT5
#РИА_ДеньРождения Герцен — российский революционер, писатель. В газете «Колокол» он требовал освобождения крестьян… https://t.co/NpejlqtTuy
Экипажи Су-34 ЗВО в рамках учений разрушили наземные объекты "противника" https://t.co/WvkhrGSSeC https://t.co/RhXZq9QgnW
?? «Важное за день» https://t.co/ni4VnUOxkP
Петербуржцы вышли на митинг памяти жертв теракта в метро https://t.co/4ouM1ZSAQj https://t.co/gyMPcfq9du
Король Иордании посоветовал Западу "торговаться" с Россией по Крыму https://t.co/ezvaFzq0lN https://t.co/F85KKtq2Wl
В акции памяти жертв взрыва в петербургском метро на Манежной площади участвуют 50 тысяч человек #ПитерМыСТобой… https://t.co/CQ29HId6Jd
Nord Stream 2 подал заявку в Германии на строительство "Северного потока-2" https://t.co/X7w9MIuLkS https://t.co/bDYvMcgx7v
В Петербурге арестовали еще двух подозреваемых в вербовке террористов https://t.co/C9nuH4MJmx https://t.co/G2SyiBechQ
Австрийский школьник предотвратил готовившуюся бойню в немецкой школе https://t.co/h6iUuQJOGg https://t.co/uMq4NPERDS
В Астрахани ликвидированы нападавшие на силовиков бандиты https://t.co/5ahOtsshNW https://t.co/rlwuOL14dl
Отпевание Евтушенко пройдет 10 апреля в храме князя Игоря Черниговского в Переделкино https://t.co/xtporVNCbG https://t.co/nNYZC9dEVq
В Петербурге взяли под стражу второго вероятного вербовщика террористов https://t.co/BFnEe9lcuU https://t.co/BHNgnrLKtj
Астрономы впервые узнали состав атмосферы "кузины Земли" https://t.co/stRFXD0W7H https://t.co/65aFGiCLxo
СМИ: австралийские телезрители помогли обнаружить ранее неизвестную планетную систему https://t.co/u17mBEtfuq https://t.co/BZogzgFDB4
Деньги нужно передать тем, кому они нужны: машинист взорванного поезда в Петербурге отказался от вознаграждения… https://t.co/MI5Wx3EuVD
Прощание с полицейскими, погибшими в Астрахани. Кадры церемонии - в фотоленте Ria.ru https://t.co/1wP5R2IsOO https://t.co/i9ZesOKzvY
Житель Саратова обворовал строящийся храм на миллион рублей https://t.co/GSyAW5luaS https://t.co/bo31Z4ejwK
Арестованный в Петербурге за вербовку террористов администрировал группы в соцсетях https://t.co/iyexoE1KDv https://t.co/GTRevC5XJr
Москва в прошлом году закупила 10 тысяч экземпляров православной энциклопедии для библиотек https://t.co/Jw3jflQ4Ew https://t.co/xLFeJXOQR5
Порошенко обвинил Россию в "провинциализме" https://t.co/pAgIXNODLF https://t.co/GnJjQCeSPJ
В Пентагоне заявили, что российские крылатые ракеты сейчас угрожают США больше, чем когда-либо… https://t.co/4Q4FKcOcRm
Бывшего охранника тюрьмы в польских Вронках осудили спустя 66 лет после совершения преступлений… https://t.co/J3GuPmup5l
Евреи и мусульмане в Бельгии выступили против запрета ритуального забоя животных https://t.co/U6xyY9oYAj https://t.co/goUnBZWnk7
Несколько хоккеистов заявили, что приедут в Пхенчхан несмотря на запрет НХЛ. Российские звезды лиги - на Ria.ru… https://t.co/HhNzjUTNAY
Российские ученые раскрыли наследственные корни мигрени https://t.co/c3Y2lnUKLw https://t.co/npn2iVCSI6
СК опроверг сообщения СМИ о взрывчатых веществах в обнаруженных в Ростове-на-Дону фонариках https://t.co/30RnQGdX0b https://t.co/wu9KD9ANvO
Британский ученый выяснил, насколько калорийна диета каннибалов https://t.co/RX4LcdksS9 https://t.co/TdvktgUzTZ
Путин в разговоре с Нетаньяху подчеркнул неприемлемость безосновательных обвинений после атаки в Идлибе… https://t.co/SsbMuTCHH9
Стала известна причина обрушения кирпичной кладки в доме в Петербурге https://t.co/VA5VhPw1je https://t.co/nrihWDuM4x
В Москве проходят акции в память о жертвах взрыва в Петербурге https://t.co/lCBHGVX8sk https://t.co/cfMfKa6XmJ
В Петербурге арестовали первого подозреваемого в вербовке террористов https://t.co/7IW1LS5xJh https://t.co/ag2gXARoeh
Бельгийская полиция "выловила" в море 50 кг кокаина на 62,5 млн евро https://t.co/abuUvYghTt https://t.co/eBX7aAHCqQ
Постановка Додина наделала много шума еще до показа в Москве из-за астрономических цен на билеты… https://t.co/EcD1IHO6Hu
В Мосуле боевики ИГ сбили военный вертолет, два пилота погибли https://t.co/eINNRVcs0J https://t.co/vQCTTSC4yf
В Ярославле трактор на полной скорости въехал в гипермаркет https://t.co/hv3LOdj0TP https://t.co/7og2Zx8I8Y
